Text,Numerical Rating,predict
"These measurements show no net increase in the sun’s output, even as global surface temperatures have risen.",3,TRUE
"A Fox News guest disparaged teenage climate activist Greta Thunberg by calling her ""mentally ill.""",3,TRUE
"Film actor and activist Jane Fonda said, ""There'd be no climate crisis if it wasn't for racism.""",3,TRUE
"Crude oil was the only major fuel type for which the United States was a net importer. Major disturbances to the energy supply, such as power outages or fuel shortages, harm the economy.",3,TRUE
"""The science tells us that Tuvalu, which I often hear about, is actually growing not sinking,""",3,TRUE
"Earlier last month, EPA finalized its first Expedited Settlement Agreement with Sigma Air, LLC, for the attempted illegal import of 3,736 pounds of R-410A, a blend of different HFCs..",3,FALSE
"Today, the US Environmental Protection Agency (EPA) announced it is seeking public comment on its proposal to address environmental justice, climate change, and PFAS contamination in its National ...",3,FALSE
EPA has made it a national enforcement and compliance priority to address the illegal import of HFCs under the current phasedown and has settled numerous cases over the last several months with co...,3,FALSE
"Resonac America also failed to give EPA the required notice of planned shipments of HFCs for the 2023 shipments and a February 2024 shipment, as well as failed to timely submit reports to the EPA ...",3,FALSE
"Today, EPA is announcing a settlement with Open Mountain Energy, LLC, a geothermal power generation company, for the attempted illegal import of hydrofluorocarbons (HFCs), which is the latest in a...",3,FALSE
EPA is aggressively pursuing similar actions against several other importers that failed to report their HFCs..,3,FALSE
"In addition to preventing illegal imports of HFCs, EPA is also using its enforcement authorities to target HFC importers that failed to accurately report their import quantities to EPA..",3,FALSE
"Under this third authority, EPA recently received five petitions from industry, states, and environmental organizations to address HFC use in refrigeration, air conditioning, and other applications..",3,FALSE
EPA also recently issued the first notices of violation (NOVs) under the American Innovation and Manufacturing Act of 2020 (AIM Act) to alleged violators who imported regulated substances without ...,3,FALSE
"Today, April 10, the US Environmental Protection Agency (EPA), filed a complaint against USA Wholesale, Inc. (“USA Wholesale”), a San Jose corporation which sells engine lubricants, for unlawfully...",3,FALSE
"EPA issued a letter recommending that Customs and Border Protection 3 deny the shipment entry into the US, and the HFCs were subsequently exported..",3,FALSE
“This case is the largest penalty imposed to date for importing super-polluting HFCs as part of EPA’s National Enforcement and Compliance Initiative on Mitigating Climate Change—and the first to r...,3,FALSE
"Reclassification of Major Sources as Area Sources Under Section 112 of the Clean Air Act | US EPA, , The US Environmental Protection Agency (EPA) is announcing its annual “Top Cities” list, spotli...",3,FALSE
"Today, the US Environmental Protection Agency (EPA) announced several enforcement actions that support national and international goals to reduce the use of hydrofluorocarbons (HFCs) in our fight ...",3,FALSE
"Since January 2022, EPA and CBP have denied entry to approximately 81 shipments of illegal HFCs..",3,FALSE
"“This is the latest in a series of EPA HFC enforcement efforts nationwide, which send a clear message that the federal government is vigilantly monitoring imports of HFCs and will hold illegal act...",3,FALSE
"Today, the US Environmental Protection Agency issued for public input a draft white paper on control techniques and measures that could reduce greenhouse gas (GHG) emissions from new stationary co...",3,FALSE
"“Our HFC enforcement efforts send a clear message to HFC importers that the federal government is vigilantly monitoring imports of HFCs and will hold illegal actors accountable.”, , In EPA’s enfor...",3,FALSE
"“This is the first time the Department of Justice is prosecuting someone for illegally importing greenhouse gases, and it will not be the last..",3,FALSE
"Since January 2022, EPA and CBP have denied entry to over 80 shipments of illegal HFCs..",3,FALSE
"Today, the United States Environmental Protection Agency (EPA) issued a final rule establishing a comprehensive program to cap and phase down the production and consumption of climate-damaging hyd...",3,FALSE
"Today, March 21, 2024, the US Environmental Protection Agency announced a settlement with Resonac America Inc. to address the company’s illegal import of hydrofluorocarbons (HFCs) at the Port of L...",3,FALSE
"Today, April 15, the US Environmental Protection Agency denied a petition to remove stationary combustion turbines from the list of sources subject to regulation for emissions of air toxics, maint...",3,FALSE
"EPA is finalizing this rule as sales of clean vehicles, including plug-in hybrid and fully electric vehicles, hit record highs last year..",3,FALSE
"Today, April 9, the US Environmental Protection Agency issued a final rule that will significantly reduce toxic air pollution from chemical plants, including ethylene oxide and chloroprene..",3,FALSE
"In addition, through implementation of the 2015 CCR rule, EPA found “historic” disposal units that are leaking and contaminating groundwater at currently regulated power plants, but which were exe...",3,FALSE
"Petitioners requested EPA remove, or “delist,” combustion turbines, saying that cancer risks from this source category were below 1-in-1 million and would meet the statutory “delisting” threshold..",3,FALSE
"For neoprene production sources, EPA is setting a 90-day deadline for beginning fenceline monitoring of chloroprene emissions..",3,FALSE
A recent poll released by the Lung Association found that a strong majority of voters support the EPA setting stricter limits on emissions from light-duty vehicles like cars or trucks..,3,FALSE
"Today, the US Environmental Protection Agency (EPA) announced a new effort under the Toxic Substances Control Act (TSCA) to streamline the review of new chemicals that could be used to displace cu...",3,FALSE
"Third, in January 2024 EPA proposed a rule to implement Congress’ requirement for a Waste Emissions Charge..",3,FALSE
All three selected applicants surpassed the program requirement of dedicating a minimum of 40% of capital to low-income and disadvantaged communities..,3,TRUE
"As part of President Biden’s Investing in America agenda, the US Environmental Protection Agency and the US Department of Energy today released a Funding Opportunity Announcement (FOA) for up to $...",3,TRUE
"Today, the US Environmental Protection Agency (EPA) announced the availability of $50 million in grant funding from President Biden’s Bipartisan Infrastructure Law to help states, Tribes and terri...",3,TRUE
"The new program builds on the success of EPA’s Ports Initiative and the Diesel Emissions Reduction Act programs, which have invested over $196 million to implement 207 diesel emissions reduction p...",3,TRUE
I am especially proud that EPA has secured commitments from today’s awardees that over 70 percent of the capital – over $14 billion – will go to low-income and disadvantaged communities..,3,FALSE
The Climate Pollution Reduction Grants program created under the Inflation Reduction Act — the largest climate investment in history — is enabling community-driven solutions to the climate crisis ...,3,FALSE
"EPA’s $5 billion Clean School Bus Program, created by President Biden’s Bipartisan Infrastructure Law, includes both a grant program where selected applicants are awarded funds to purchase buses, ...",3,FALSE
"Background, , In 2019 and 2020, EPA awarded a total of  more than $110,000  and more than $3 million in cooperative agreement grants, respectively..",3,FALSE
EPA estimates that the grants will be awarded by fall 2024..,3,FALSE
"Prioritized school districts in low-income, rural, and/or Tribal communities make up approximately 86% of the projects selected for funding..",3,FALSE
Today’s announcement builds on $550 million announced last week for EPA’s new Environmental Justice Thriving Communities Grantmaking program and $100 million announced earlier this year for enviro...,3,FALSE
"Docket 4: Funding to Address Air Pollution, , EPA received over $300 million in funding to support the agency’s air quality mission by investing in a range of activities that will increase monitor...",3,FALSE
EPA recently announced the launch of the $3 billion Clean Ports Program to help tackle emissions from heavy-duty vehicles both in and out of US port communities..,3,FALSE
"GWA receives some grant funding from EPA for wastewater and drinking water projects, including $50 million in Bipartisan Infrastructure Law funding over the past two years..",3,FALSE
"EPA initiatives to protect children’s health include:, , EPA’s Clean Bus Program will invest $5 billion over the next 5 years to replace existing diesel school buses with zero-emission and low-emi...",3,FALSE
"The US Environmental Protection Agency (EPA) and the Philippines Department of Environment and Natural Resources (DENR) established a memorandum of understanding (MOU) on Tuesday, November 14, 202...",3,FALSE
"Climate United Fund’s program will focus on investing in harder-to-reach market segments like consumers, small businesses, small farms, community facilities, and schools—with at least 60% of its i...",3,FALSE
"Today, the US Environmental Protection Agency (EPA) announces the selection of 11 organizations expected to receive a total of approximately $2 million in funding to divert food waste from landfil...",3,FALSE
The funding opportunities were created under President Biden’s Inflation Reduction Act — the largest climate investment in history — and will advance environmental justice by reducing diesel pollu...,3,FALSE
"“Replacing older, more polluting diesel vehicles and equipment with cleaner new alternatives will reduce harmful diesel exhaust in nearby communities while supporting local economies.”, , A total ...",3,FALSE
"This section establishes a wide range of eligible applicants that includes individuals, state, local and Tribal Air pollution control agencies, and other public or nonprofit private agencies, inst...",3,FALSE
"In addition, EPA made available about $32 million for states and territories to improve solid waste management planning, data collection and implementation of plans..",3,FALSE
"The Grant Funding to Address Indoor Air Pollution at Schools Program, , EPA anticipates awarding four to six grants of $5 million to $8 million to support five years of school indoor air quality a...",3,FALSE
"Additionally, EPA recently announced the launch of the $3 billion Clean Ports Program to help tackle emissions from ports, including the movement of heavy-duty vehicles both in and out of communit...",3,FALSE
The US Environmental Protection Agency (EPA) and the US Department of Energy (DOE) announced a Notice of Intent (NOI) today to make funds available to help measure and reduce methane emissions fro...,3,FALSE
"Achieve a private capital mobilization ratio of nearly 7 times, with every dollar in grant funds leveraged for almost seven dollars in private funds over the next seven years—turning $20 billion o...",3,FALSE
"Tribes have a set-aside of $25 million, for grants up to $500,000 for a single Tribe or $1 million for groups of 2 or more..",3,FALSE
"Today, the US Environmental Protection Agency (EPA) announced initial public engagement and input opportunities for a subset of new and existing programs funded by President Biden’s Inflation Redu...",3,FALSE
The US Environmental Protection Agency on Thursday announced the availability of up to $32 million to address indoor air pollution in schools as part of President Biden’s Investing in America agen...,3,FALSE
"Investing in projects from our $30 billion pipeline and working with all community lenders, we and other award winners will prove that public-private investment delivers cheap, clean power fast to...",3,FALSE
"GHG Corporate Reporting, , Funding includes $5 million to enhance standardization and transparency of corporate climate action commitments and plans to reduce greenhouse gas emissions, enhance tra...",3,FALSE
"Today’s investments are just the beginning – they will be multiplied seven times over to turbocharge our transition to a clean energy economy,” said US Senator Chris Van Hollen, who first introduc...",3,FALSE
"Funds are slated to support the purchase of approximately 2,700 buses, 95% of which will be electric..",3,FALSE
"EPA received $41.5 billion in appropriations to develop and support 24 new and existing programs that monitor and reduce greenhouse gas emissions and air pollution, protect health and advance envi...",3,FALSE
"Today, March 14, the US Environmental Protection Agency (EPA) announced nearly $1.2 million, in funding to 16 college student teams to research and develop innovative solutions that address enviro...",3,FALSE
"And they will dedicate over $14 billion of capital—over 70% of the selections for awards announced today—toward low-income and disadvantaged communities, making the Greenhouse Gas Reduction Fund t...",3,FALSE
"Today, the US Environmental Protection Agency (EPA) announced a direct award of $8.8 million through President Biden’s Investing in America Agenda to Northeast States for Coordinated Air Use Manag...",3,FALSE
"In April 2023, EPA announced the availability of at least $400 million for its 2023 Clean School Bus Grants through a Notice of Funding Opportunity..",3,FALSE
"Additionally, the Inflation Reduction Act statute requires that at least $400 million of the program’s funding go to projects that will serve one or more communities dealing with significant pollu...",3,FALSE
"Today, April 22, as the Biden-Harris Administration celebrates Earth Day, the US Environmental Protection Agency announced 60 selectees that will receive $7 billion in grant awards through the Sol...",3,FALSE
EPA is prioritizing environmental justice by ensuring nearly half of the funds announced today will be awarded to projects or recipients located in underserved communities..,3,FALSE
"In 2023, under the first phase of the $5 billion program, EPA provided $250 million in grants to 45 states, the District of Columbia, Puerto Rico, 82 metropolitan statistical areas, four territori...",3,FALSE
"“With nearly $1 billion in investment already made, school districts in rural and urban America have eagerly taken advantage of this program..",3,FALSE
"DOCKET 2: Transportation Programs, , EPA received $4 billion for two new programs to reduce emissions from the transportations sector..",3,FALSE
"About the Clean School Bus Program, , EPA’s Clean School Bus Program was created under President Biden’s Bipartisan Infrastructure Law and provides an unprecedented $5 billion of funding to transf...",3,FALSE
"With today’s announcement, EPA’s Clean School Bus Program has awarded nearly $2 billion and funded approximately 5,000 electric and low-emission school buses nationwide..",3,FALSE
"Of this funding, $15 million is dedicated towards new competitive grants for reclaim and innovative destruction technologies, $20 million is dedicated to EPA to carry out the AIM Act, and $3.5 mil...",3,FALSE
"Today, April 24, the US Environmental Protection Agency announced the launch of the nearly $1 billion Clean Heavy-Duty Vehicles Grant Program to fund the replacement of certain polluting heavy-dut...",3,FALSE
EPA anticipates approximately 70% of available funding will be for projects under the School Bus Sub-Program and approximately 30% of available funding will be for projects under the Vocational Ve...,3,FALSE
"Recently, the 2021 Bipartisan Infrastructure Law provided the largest EPA investment in recycling in 30 years, supporting improvements to waste management systems and programs..",3,FALSE
"Dedicate over $14 billion toward low-income and disadvantaged communities, including over $4 billion for rural communities as well as almost $1.5 billion for Tribal communities—ensuring that progr...",3,FALSE
"Through the 2024 Diesel Emissions Reduction Act Tribal and Territory Grants Notice of Funding Opportunity, EPA anticipates awarding approximately $9 million in total DERA funding to eligible appli...",3,FALSE
"Given the overwhelming demand and large number of high-scoring applications, including applicants in low-income communities, EPA has nearly doubled the amount of funding that will be awarded this ...",3,FALSE
"The National Trust Community Investment Corporation, Appalachian Community Capital’s partner, recently led the charge on a $5.7 million sustainable rehabilitation of the historic National Guard Ar...",3,FALSE
The US Environmental Protection Agency on Tuesday announced the selection of nine grant applicants to receive an expected $10.67 million in funding to enhance wildfire smoke preparedness and prote...,3,FALSE
"Just this past year in September, EPA selected 25 communities to receive grants totaling more than $73 million under the newly created Solid Waste Infrastructure for Recycling funding opportunity..",3,FALSE
"States, , Under the formula-based program for planning grants, the governments of all states, the District of Columbia, and Puerto Rico are eligible for up to $3 million..",3,FALSE
"Today, the US Environmental Protection Agency (EPA) announced Phase Two winners of the Cleaner Indoor Air During Wildfires Challenge..",3,FALSE
This area is anticipated to complement efforts currently being undertaken by states through recently announced formula grants..,3,FALSE
"The US Environmental Protection Agency (EPA) today announced settlements with Canadian-based Crescent Point Energy US Corp. (Crescent Point) and Houston, Texas-based EP Energy E & P Company, L.P. ...",3,TRUE
"Today, The US Environmental Protection Agency (EPA), the Justice Department and the Commonwealth of Massachusetts announced a settlement agreement with the City of Lowell, Massachusetts, requiring...",3,TRUE
"Today, April 10, The Environmental Protection Agency (EPA) and the US Department of Justice reached a settlement with Colonial Oil Industries Inc., that will require the company to pay a civil pen...",3,FALSE
"The combined penalties paid in these cases against Combs Investment Property, LP; Waysmos USA, Inc.; and Nature Gas Import and Export Inc., exceed $500,000..",3,FALSE
"The Environmental Protection Agency (EPA) and Justice Department today announced that Swinerton Builders has agreed to pay a $2.3 million penalty – divided between the United States, Alabama Depar...",3,FALSE
"The EP Energy settlement resolves similar violations across 246 production facilities and requires the company to pay a civil penalty of $700,000, take extensive measures to ensure future complian...",3,FALSE
"EP Energy emerged from bankruptcy on October 1, 2020, and the United States and Utah previously resolved alleged violations subject to a proof of claim in the bankruptcy court for $100,000..",3,FALSE
"The Justice Department, Environmental Protection Agency (EPA), California Air Resources Board (CARB) and the California Attorney General’s office today released the details of a proposed settlemen...",3,FALSE
The Crescent Point settlement requires the company to pay a civil penalty of $3 million for violations of requirements to control volatile organic compound (VOC) emissions from storage tanks at 30...,3,FALSE
"Apache will also spend over $1 million to offset the harm caused by the alleged violations by replacing, on an accelerated schedule, more than 400 pollutant-emitting pneumatic devices with non-emi...",3,FALSE
"Since it began in 2008, the GreenChill Store Certification Program has issued more than 4,400 annual certifications to over 1,300 individual stores..",3,TRUE
"Hillphoenix (Conyers, Ga.) achieved this recognition for the 11th consecutive year as the commercial systems manufacturer with the most systems installed in GreenChill Certified Stores in the last...",3,FALSE
"Hannaford – The Turner, Maine, store achieved GreenChill Store Certification for 10 consecutive years..",3,FALSE
"In 2022, there were nearly 900 GreenChill Certified Stores throughout the nation..",3,FALSE
"Weis Markets – The Danville, Pennsylvania, store achieved GreenChill Store Certification for five consecutive years..",3,FALSE
"Meijer – The Marysville, Ohio, store achieved GreenChill Store Certification for five consecutive years..",3,FALSE
"Store Recertification Excellence, , ALDI – A total of 109 locations across California, Connecticut, Georgia, Maryland, Massachusetts, Michigan Minnesota, New Hampshire, New Jersey, New York, Ohio,...",3,FALSE
"Since GreenChill launched in 2007, many food retailers have joined the Corporate Emissions Reduction Program (the Partnership) with the number of stores nearly tripling from 4,500 to more than 13,...",3,FALSE
"Publix Super Markets – Five locations in Alabama, North Carolina, and South Carolina achieved five-year recertifications..",3,FALSE
"On average, GreenChill food retailers maintain emissions rates that are approximately half the industry average, resulting in a significant benefit to the environment..",3,FALSE
"Store Certification Excellence, , ALDI (Batavia, Ill.) earned recognition for certifying 628 GreenChill Certified Stores over the past year, more stores than any supermarket chain has previously a...",3,FALSE
"First released in 2009, EPA’s list of cities with the most ENERGY STAR certified buildings shows how buildings across America are embracing energy efficiency as a simple and effective way to save ...",3,TRUE
"Coming in at first place for the fourth year in a row, Los Angeles leads with nearly 750 ENERGY STAR certified buildings..",3,FALSE
"Nearly 2.5 million energy-efficient new homes and apartments have earned ENERGY STAR certification to date, and about 10% of all US homes built in America earned the ENERGY STAR label last year..",3,FALSE
"Today, March 14, 2024, the US Environmental Protection Agency recognized 103 US manufacturing plants that earned the agency’s ENERGY STAR certification in 2023, a designation reserved for manufact...",3,FALSE
"Nissan North America, Inc., replaced more than 20,000 light fixtures with LEDs across all US manufacturing sites and conducted a combination of energy treasure hunts and third-party assessments ta...",3,FALSE
"Since 1992, ENERGY STAR and its partners helped American families and businesses avoid more than $500 billion in energy costs and achieve more than 4 billion metric tons of greenhouse gas reductio...",3,FALSE
ENERGY STAR certified buildings use an average of 35% less energy and are responsible for 35% less carbon dioxide emissions than typical buildings..,3,FALSE
More than 270 plants have achieved ENERGY STAR certification since 2006..,3,FALSE
ENERGY STAR certified buildings use an average of 35% less energy and are responsible for 35% fewer greenhouse gas emissions than typical buildings..,3,FALSE
"To develop the 1–100 ENERGY STAR score for vehicle dealerships, EPA relied on 2019 data from an industry survey conducted by the National Automobile Dealers Association..",3,FALSE
The assessment showed that the rule would reduce the number of people who have elevated air toxics-related cancer risk by 96% in those communities – and the final delivers those reductions..,3,FALSE
"In 2036 alone, the year the final reduction step is made, this rule is expected to prevent emissions of the equivalent of 171 million metric tons of carbon dioxide (CO2) – roughly equal to the ann...",3,FALSE
"Compliance with this robust settlement will result in annual reductions of more than 9,650 tons of Volatile Organic Compounds (VOCs) and 900 tons of methane, which equates to more than 25,000 tons...",3,FALSE
"In 2023, sources in both the Cross-State Air Pollution Rule annual program and the Acid Rain Program together emitted 0.65 million tons of SO2, a reduction of 11.2 million tons from 1995 levels..",3,FALSE
The total emission reductions of the proposal from 2022 to 2050 are projected to amount to the equivalent of 4.7 billion metric tons of CO2 – nearly equal to three years of US power sector emissio...,3,FALSE
"By slashing over 6,200 tons of toxic air pollutants annually and implementing fenceline monitoring, this addresses health risks in surrounding communities and promotes environmental justice in sta...",3,FALSE
"The regulatory impact analysis projects reductions of 1.38 billion metric tons of carbon pollution overall through 2047, which is equivalent to preventing the annual emissions of 328 million gasol...",3,FALSE
"While complying with programs to reduce SO2, NOx, and mercury, power plants reduced their CO2 emissions by 28% between 1995 and 2023..",3,FALSE
These commonsense standards will slash the source of a fifth of the nation’s carbon footprint..,3,FALSE
"Additionally in 2023, sources in these programs together emitted 0.64 million tons of NOx, a 5.2-million-ton reduction from 1995 levels..",3,FALSE
"These standards will avoid more than 7 billion tons of carbon emissions and provide nearly $100 billion of annual net benefits to society, including $13 billion of annual public health benefits du...",3,FALSE
"Over time, these rules will prevent more carbon pollution than the entire US economy coughs up in a year..",3,FALSE
Roughly half of this improvement resulted from units more effectively operating their existing controls and half resulted from increased utilization of more highly controlled units..,3,FALSE
