Text,Numerical Rating,predict
"Accordingly, a reduction of 900 tons of annual methane reductions equates to more than 25,000 tons of CO2, akin to eliminating the use of more than 2.5 million gallons of gasoline annually..",3,FALSE
"The final rule is expected to avoid 7.2 billion tons of CO2 emissions through 2055, roughly equal to four times the emissions of the entire transportation sector in 2021..",3,FALSE
This project will reduce VOC emissions by approximately 370 tons per year as a result of installing emission control devices at uncontrolled facilities..,3,FALSE
"Additionally, ozone season (May 1 to September 30) NOX emissions decreased by 9% nationwide and 18% for the 10 states implementing the Good Neighbor Plan..",3,FALSE
"Compared to the existing MY 2026 standards, the final MY 2032 standards represent a nearly 50% reduction in projected fleet average GHG emissions levels for light-duty vehicles and 44% reductions ...",3,FALSE
"""Race is the No. 1 indicator for where toxic and polluting facilities are today.""",3,FALSE
"In fact, the transition would result in up to 110,000 fewer deaths and $1.2 trillion in public health benefits across the United States by 2050..",3,FALSE
Most U.S. households are currently food secureExit EPA’s website.,3,FALSE
"Radon remains a prominent health hazard in the United States, with millions of residences exhibiting elevated levels..",3,FALSE
"About 3.3 million homes in the US have children less than six years of age facing one or more lead-based paint hazards, including over 2 million low-income households..",3,FALSE
"Tens of millions of homes have already been tested, and millions of homes with high radon levels have been fixed..",3,FALSE
"“EPA estimates that in 2032, the nation will see 4,500 fewer premature deaths, 290,000 fewer lost workdays, 800,000 fewer cases of asthma symptoms and 2,000 fewer emergency department visits from ...",3,FALSE
"As the leading cause of lung cancer among non-smokers, radon accounts for approximately 21,000 lung cancer deaths annually..",3,FALSE
"In 2020 alone, reductions in air pollution prevented more than 230,000 premature deaths, 200,000 heart attacks, 120,000 emergency room visits, and 17 million lost workdays.",3,FALSE
More than 34 million homes in the US have lead paint somewhere in the building..,3,FALSE
"“Studies estimate that residential wood smoke emissions account for 10,000 – 40,000 premature deaths annually in the United States,” said Joseph Goffman, Principal Deputy Assistant Administrator f...",3,FALSE
Three key impacts of climate change are described in this section. A growing concentration of people live in the nation’s coastal areas.,3,TRUE
"For more specific examples of climate change impacts in your region, please see the National Climate AssessmentExit EPA’s website. Agriculture contributed more than $1.",3,TRUE
"“Since 1961, Africa has witnessed a one-third reduction in agricultural productivity due to climate change.”",3,FALSE
"Global warming will result in ""more evaporation"" and more rain in ""more places,"" and that's ""surely gotta shrink the deserts and expand the green growth.""",3,FALSE
“Every single county in New York has experienced a federal climate disaster between 2011-2021.”,3,FALSE
The continued melting of ice caps due to human-caused climate change could release long-dormant bacteria and viruses able to infect their targets,3,FALSE
"Some communities, including Boston, Houston, and Orlando, are seeing twice as many tidal flooding days each year as they did 20 years ago.",3,FALSE
Agricultural workers face several climate-related health risks.,3,FALSE
"The forest-products industry employs over 900,000 people in the United States.",3,FALSE
"For example, scientists predict that some areas, such as the Bering Sea, will see more kinds of fish as warming waters drive populations north.",3,FALSE
"Communities on the coasts also support more than 58 million jobs in the fishing, tourism, real estate, defense, and other industries.",3,FALSE
Climate Change Indicators in the United States: Health and Society. Centers for Disease Control and Prevention (CDC)Exit EPA’s website.,3,FALSE
"By 2050, up to $106 billion worth of coastal property will likely be below sea level if current trends continue. U.S. coastal counties face permanent inundation and flooding threats from sea level...",3,FALSE
"About 30% of all first responders develop depression, anxiety, or post-traumatic stress disorder after responding to a natural disaster or extreme weather event.",3,FALSE
"In vulnerable regions, the death rate from extreme weather events in the last decade was 15 times higher than in less vulnerable ones.",3,FALSE
"Most hired crop farmworkers are not migrant workers; instead, they work at a single location within 75 miles of their homes.",3,FALSE
Energy systems on both the Gulf and East Coasts face more risk of damage from flooding due to hurricanes and sea level rise.,3,FALSE
"For example, federal agencies that manage the nation’s natural resources are now considering climate change in polices and planning.",3,FALSE
"Rising temperatures and carbon dioxide concentrations may increase some crop yields, but the yields of major commodity crops (such as corn, rice, and oats) are expected to be lower than they would...",3,FALSE
Rising water and air temperatures have already forced some nuclear plants to temporarily close to lower the risk of overheating.,3,FALSE
The number of people employed in the transportation sector in 2020 represents 10% of the U.S. workforce.,3,FALSE
It also generates over $200 billion a year in sales and makes up about 6% of the U.S. manufacturing gross domestic product.,3,FALSE
The WHO conservatively projects 250 000 additional yearly deaths by the 2030s due to climate change impacts on diseases like malaria and coastal flooding.,3,FALSE
"Since early 2020, the U.S. Southwest has been experiencing one of the most severe long-term droughts of the past 1,200 years.",3,FALSE
"As the climate changes, average and extreme temperatures are increasing,9, 10 along heat waves.",3,FALSE
"Older adults, pregnant women, and children are at particular risk, as are people living in urban areas because of the additional heat associated with urban heat islands.",3,FALSE
"Increases in average and extreme temperatures and heat waves are expected to lead to more heat illnessesExit EPA’s website and deaths among vulnerable groups, including people with disabilities.",3,FALSE
"There are over two million farms in the United States, and more than half the nation’s land is used for agricultural production.",3,FALSE
"For example, rising temperatures, drought, and reduced snowfall are putting more pressure on water supplies in the Southwest.",3,FALSE
"Children, including adolescents under the age of 18, are often more vulnerable than the general population to the health impacts of climate change because:.",3,FALSE
The New York City metro area provided extra bus service after Superstorm Sandy to make up for flooded subway and commuter tunnels.,3,FALSE
"Summarizes climate change impacts, adaptation strategies, and mitigation strategies with a focus on ecosystems. EPA’s Report on Seasonality and Climate Change.",3,FALSE
Among the many examples cited by the 2018 National Climate AssessmentExit EPA’s website are an increase in heat waves and days with temperatures above 90°F; more extreme weather events such as sto...,3,FALSE
These zones are expected to increase in number and size as the ocean warms and heavier rains wash more nutrient-laden runoff into coastal waters.,3,FALSE
"With the poorest people largely uninsured, health shocks and stresses already currently push around 100 million people into poverty every year, with the impacts of climate change worsening this tr...",3,FALSE
"For example, the stress caused by rising water temperatures and ocean acidification could cost the shellfish industry hundreds of millions of dollars.",3,FALSE
Harmful algal blooms already cost the country nearly $1 billion each year from the loss of recreational fishing and boating revenue.,3,FALSE
"For example, many states are upgrading and protecting their energy infrastructure from extreme weather.",3,FALSE
"At the same time, some urban areas are experiencing repeated flooding from heavy rains that overwhelm drainage systems.",3,FALSE
"They also breathe at a faster rate, increasing their exposure to dangerous air pollutants. Children tend to spend more time outdoors than adults, increasing their exposure to heat and cold, rain a...",3,FALSE
"One study found that compared to men, women were at increased risk for PTSD and other mental health effects after a disaster.",3,FALSE
"Climate change can have pros and cons for U.S. shipyards, which support around $40 billion in gross domestic product.",3,FALSE
Many cities already experience urban heat islands.,3,FALSE
"With 2°C (3.6°F) of global warming, Hispanic and Latino individuals are 43% more likely to currently live in areas with the highest projected reductions in labor hours due to extreme temperatures..",3,FALSE
Three key impacts are described in this section. More than 100 million people in the United States live in areas with poor air quality.,3,FALSE
A 2023 EPA report quantifies projected health effects to children from climate change.,3,FALSE
"Even without the impacts of climate change, the United States’ water supply has begun to diminish.",3,FALSE
"In some coastal areas, more flooding is occurring as the sea level rises.",3,FALSE
"For example, a large heat wave off the West Coast in 2014 shut down crab fisheries and starved baby sea lions. Commercial and recreational marine fisheriesExit EPA’s website in some regions are at...",3,FALSE
"More than 60,000 miles of roads and bridges are located in U.S. coastal floodplains.",3,FALSE
"In the West, warmer temperatures and changes in precipitation are reducing snowpack.",3,FALSE
"In contrast, the Northeast and Southeast may experience more extreme storms and heavy rains, which can put aging water infrastructure (such as dams, sewers, and water treatment facilities) at risk...",3,FALSE
"In fact, more than three-fourths of all trade involves marine transportation. Damage to the coasts, such as from hurricanes and flooding, has negative impacts on the economy.",3,FALSE
It further reveals that 3. billion people already live in areas highly susceptible to climate change.,3,FALSE
"By 2050, up to $106 billion worth of coastal property will likely be below sea level if current trends continue. More intense rains.",3,FALSE
"For example, childhood disability has been rising in recent years, with the rates highest among American Indian and Alaska Native children and those living in poverty. As the climate changes, some...",3,FALSE
"Intense, single-day rainstorms are rising, increasing the risk of urban flooding, especially in areas with a lot of paved surfaces.",3,FALSE
Coastal counties produce more than $9.,3,FALSE
Forests and woodlands cover more than 822 million acres of land in the United States—about 36% of the country’s total land.,3,FALSE
"Increases in average and extreme temperatures are expected to lead to more heat illnesses and deaths among vulnerable people, including pregnant women.",3,FALSE
Among the health impacts cited by the 2018 National Climate AssessmentExit EPA’s website are the following:.,3,FALSE
"There were more than 75 million older adults (60 years or older) in the United States in 2019, making up over one-fifth of the population.",3,FALSE
"Mold, dust mites, bacteria, and other indoor pollutants may increase as climate change-related precipitation and storms increase.",3,FALSE
"For example, a disproportionate number of flood-related deaths from Hurricane Katrina were older adults. Not everyone will be able to prepare for or respond equally to climate change threats in co...",3,FALSE
"For instance, Native American/Alaska Native infants are hospitalized more for diarrheal disease than infants in the general U.S. population—often due to a lack of safe and reliable drinking water.",3,FALSE
"Yet, elsewhere, communities are relocating entirely; members of the Isle de Jean Charles Band of the Biloxi-Chitimacha-Choctaw Tribe are planning to resettle inland after losing 98% of their triba...",3,FALSE
These shifts are projected to result in losses of hundreds of millions of dollars each year by the year 2100.,3,FALSE
"Climate change impacts to coastal communities affect not only human health, but also properties, infrastructure, and services. More than $1 trillion worth of property is located within 700 feet of...",3,FALSE
"Consolidates all federal resources that present information, tools, or strategies on managing heat-related illnesses. AirNow Air Quality Index.",3,FALSE
"Transportation systems are also vulnerable to multiple climate change stressors, including extreme temperatures and heavy precipitation.",3,FALSE
Pacific island communities are already experiencing saltwater contamination of groundwater systems due to sea level rise.,3,FALSE
"By 2050, up to $106 billion worth of coastal property will likely be below sea level if current trends continue.",3,FALSE
"In 2010, heat stress lowered annual U.S. dairy production by an estimated $1.",3,FALSE
"Natural disasters and droughts can also lead to more tobacco and alcohol use, as well as domestic violence., 29 In addition, heat overall has been linked to increases in violence. For more specifi...",3,FALSE
"As a result, thousands of sea lion pups starved. Decreases in commercial fishing harvests.",3,FALSE
"For example, populations of Chinook and chum salmon hit record lows in 2021, leading to the closure of subsistence salmon fishing for much of the year.",3,FALSE
"Without preventive actions, deaths from such diseases, currently over 700 000 annually, may rise.",3,FALSE
"In 2015, urban areas contributed about 91% of the United States’ gross domestic product (GDP).",3,FALSE
This “business as usual” scenario is projected to cause hundreds of billions of dollars of damage per year by 2090.,3,FALSE
EPA published revised factsheets on climate change to explain its impacts on maternal and children’s health..,3,FALSE
"Some communities, including Boston, Houston, and Orlando, are seeing twice as many tidal flooding days each year as they did 20 years ago. Impacts to coastal ecosystems.",3,FALSE
"More than 60,000 miles of U.S. roads and bridges in coastal areas are at risk of flooding and damage from climate-change-related sea level rise.",3,FALSE
"It threatens our health and environment — affecting approximately 63 million Americans and posing particular risks to infants, children, pregnant individuals, seniors, communities of color, and pe...",3,FALSE
"However, scientific advances progressively allow us to attribute an increase in morbidity and mortality to global warming, and more accurately determine the risks and scale of these health threats...",3,FALSE
"From 1932 to 2016, Louisiana lost more than 2,000 square miles of land area, mostly wetlands, in part due to rising sea levels.",3,FALSE
"These learning losses can affect future income, with potential losses across cohorts of graduating students reaching billions of dollars annually (and in the thousands of dollars per individual)..",3,FALSE
"They also recover in a few days to a week. Trauma from extreme weather events can cause psychological stress, worsen mental illnesses, and add emotional stress for pregnant and postpartum women.",3,FALSE
Extreme heat is already the leading cause of weather-related deaths in the United States.,3,FALSE
"In 2019, there were more than 41 million U.S. adults living with a disability.",3,FALSE
"Climate change impacts affect the livelihoods of millions of Americans, including fishers, loggers, ranchers, and farmers.",3,FALSE
"Between 2030 and 2050, climate change is expected to cause approximately 250 000 additional deaths per year, from undernutrition, malaria, diarrhoea and heat stress alone.",3,FALSE
"The marine economy also generated $397 billion in gross domestic product (GDP), which was 1.% of the national GDP. Commercial fisheries are an important contributor to the economy.",3,FALSE
Many cities are already dealing with multiple impacts from climate change.,3,FALSE
The city is elevating some buildings to protect them from climate change.,3,FALSE
"When temperatures rise, the carrying capacity of transmission lines decreases.",3,FALSE
"Certain immigrant groups and communities of color have a greater incidences of kidney disease, diabetes, and chronic obstructive pulmonary disorder (COPD).",3,FALSE
"For example, infants living on the Fort Apache reservation in Arizona have had higher hospitalization rates for diarrheal disease than infants in the general U.S. population. Increasing water temp...",3,FALSE
This rises to 59% under 4°C of global warming..,3,FALSE
"A new EPA analysis released today shows that the most severe harms from climate change fall disproportionately upon underserved communities who are least able to prepare for, and recover from, hea...",3,FALSE
"In fact, while coastal counties make up only 10% of the nation’s land mass (excluding Alaska), they are home to 40% of the population.",3,FALSE
"In addition, many groups of urban residents live with high levels of air pollution.,28 Black and African American individuals are 34% more likely to live in areas with the highest projected increa...",3,FALSE
"In addition, urban lands are worth trillions of dollars.",3,FALSE
"For example, many government agencies already use the national public warning systemExit EPA’s website to communicate extreme weather threats.",3,FALSE
America’s East Coast is projected to see a 20% to 30% decrease in fish harvests by 2060.,3,FALSE
Damage to coral reefs due to climate change is projected to result in $140 billion in total lost revenues to the U.S. recreation industry by 2100.,3,FALSE
A 2021 EPA report examines the degree to which certain socially vulnerable populations may be more exposed to the highest impacts of climate change. A number of climate-related hazards threaten th...,3,FALSE
"Exposure to extreme or prolonged heat can cause exhaustion, heat stroke, kidney and heart disease, and pregnancy complications.,10 In fact, extreme heat is already the leading cause of weather-rel...",3,FALSE
"Atmospheric warming has the potential to increase ground-level ozone in many regions, which can cause multiple health issuesExit EPA’s website (e.g., bronchitis, emphysema, and asthma) and worsen ...",3,FALSE
"The marine economy generated over $665 billion in sales in 2019, with tourism and recreation, including recreational fishing, making up more than one-third of that total.",3,FALSE
"For example, more than 25 million Americans have disabilities that make traveling outside their home difficult.",3,FALSE
"In some areas, less snow is falling, as more precipitation is falling as rain rather than snow., 5 Higher temperatures are also causing snowpack to melt earlier.",3,FALSE
"About 85% of Americans live in metropolitan areas, and that number is projected to grow over the next 100 years.",3,FALSE
"Rising temperatures and carbon dioxide concentrations may increase some crop yields, but the yields of major commodity crops (such as corn, rice, and oats) are expected to be lower than they would...",3,FALSE
Many coastal cities and counties are focusing on land use planning to encourage smart growth and reduce the impacts of climate change.,3,FALSE
"With regards to transportation, Hispanic and Latino individuals are about 50% more likely to currently live in areas with the highest estimated increases in traffic delays due to increases in coas...",3,FALSE
"Marine regions, like the ocean and estuariesExit EPA’s website, have more salt than freshwaters like lakes, rivers, streams, and ponds.",3,FALSE
Food service makes up the largest share of these jobs at 13 million.,3,FALSE
Heat-related deaths among those over 65 have risen by 70% in two decades.,3,FALSE
"For example, the Isle de Jean Charles Band of Biloxi-Chitimacha-Choctaw tribe in Louisiana has lost 98 percent of its land mass.",3,FALSE
"Climate change is directly contributing to humanitarian emergencies from heatwaves, wildfires, floods, tropical storms and hurricanes and they are increasing in scale, frequency and intensity. Res...",3,FALSE
"When including the coast of the Great Lakes, more than 128 million people live in coastal counties.",3,FALSE
"Increases in average and extreme temperatures and heat waves are expected to lead to more heat illnessesExit EPA’s website and deaths among vulnerable groups, including certain socially vulnerable...",3,FALSE
All U.S. regions are experiencing the impacts of climate change but impacts vary by area and ecosystem.,3,FALSE
Energy use in commercial and residential buildings accounts for one-third of US greenhouse gas emissions..,3,FALSE
The oil and natural gas sector is the largest industrial source of methane emissions in the United States..,3,FALSE
Methane accounts for 12% of all US greenhouse gas emissions from human activities..,3,FALSE
"Petroleum and natural gas systems were the second largest stationary source of emissions, reporting 316 million metric tons of greenhouse gas emissions..",3,FALSE
"At the same time, heavy-duty vehicles account for 25 percent of all greenhouse gas emissions from the transportation sector, which is itself the single largest source of greenhouse gas emissions i...",3,FALSE
"In the United States, the transportation sector is the largest source of greenhouse gas emissions, and a leading source of health-harming pollution..",3,FALSE
"The Organisation for Economic Co-operation and Development estimates that in 2019, plastic products were responsible for 3.4% of global greenhouse gas emissions throughout their life cycles, with ...",3,FALSE
"Oil and natural gas operations are the nation’s largest industrial source of methane, a climate “super pollutant” that is many times more potent than carbon dioxide and is responsible for approxim...",3,FALSE
"The energy sector is the largest emitter of greenhouse gases into the atmosphere, contributing to climate change.",3,FALSE
"Pound for pound, methane is approximately 28 times more powerful than carbon dioxide in terms of its impact on global warming..",3,FALSE
"The data show that in 2022:, , Power plants were the largest stationary source of US greenhouse gas emissions, with 1,332 facilities emitting approximately 1.6 billion metric tons of carbon dioxide..",3,FALSE
Methane is a climate “super pollutant” that is more potent than carbon dioxide and responsible for approximately one third of the warming from greenhouse gases occurring today..,3,FALSE
"More than 8,100 direct emitters and suppliers report GHG data to GHGRP..",3,FALSE
The state-level GHG Inventory provides annual emissions estimates from 1990 through 2019 and will be updated each year..,3,FALSE
Greta Thunberg's Message To PM Modi On Climate Crisis,3,FALSE
Covid-19 is a deliberate hoax designed to promote the climate change agenda.,3,FALSE
All English schoolchildren are taught geography until at least the age of 14 — many until 16 — and in geography they’re taught about climate change.,3,FALSE
Four Oxford schoolgirls have started a petition to make lessons on climate change compulsory in schools.,3,FALSE
A picture shows the aftermath of climate strikers in Hyde Park in London on 20 September.,3,FALSE
"The term “climate change” will now be “climate emergency.""",3,FALSE
"""I’m one of the first guys to introduce a climate change bill, way, way back in ‘87.""",3,FALSE
"""The vast majority of Americans believe that climate change is real and we need to do something about it.""",3,FALSE
"""In last week’s debate, Bernie questioned Hillary’s commitment to fighting climate change because a whopping 0.2 percent of the money given to our campaign has come from employees of oil and gas c...",3,FALSE
"""Nancy Mace denies climate change.""",3,FALSE
"""The White House removed its climate change web page. And the healthcare, civil rights and LGBT sections.""",3,FALSE
Social media users claimed that a weather report was using digital flames to exaggerate a heat wave.,3,FALSE
The Florida state Department of Education approved content that denies or minimizes the reality of anthropogenic climate change and compares climate science to Nazism as an optional supplement to ...,3,FALSE
U.S. Rep. Louie Gohmert asked whether the moon's orbit could be changed to help solve the issue of climate change.,3,FALSE
Activists with the climate group Extinction Rebellion have broken windows of banks in London as part of protest against financial institutions that support the fossil fuel industry.,3,FALSE
The Wisconsin Department of Natural Resources’ webpage regarding climate change’s potential effects on the Great Lakes was scrubbed of references to the word ‘climate’.,3,FALSE
A 1912 article warned coal burning can have a negative effect on climate,3,FALSE
"The Intergovernmental Panel on Climate Change's (IPCC) Sixth Assessment Report (AR6) concluded that climate risks are appearing faster and will become more severe sooner than previously expected, ...",3,FALSE
"Compared to 2022, the 2023 data show a 15% decrease in NOX emissions, a 24% decrease in SO2 emissions, a 7% decrease in carbon dioxide (CO2) emissions, and a 17% decrease in mercury emissions..",3,TRUE
"Nationwide, emissions for 2023 show the most significant emissions reductions since 2020..",3,TRUE
"There has been an overall long-term decreasing trend in industry GHG emissions since 2011, primarily driven by a decrease in emissions from power plants to lower emissions inputs such as natural g...",3,TRUE
"Net US greenhouse gas emissions were 5,489 million metric tons of carbon dioxide equivalent in 2022, a 1.3% increase in emissions from 2021..",3,TRUE
